{
  "contracts": [
    {
      "consumers": [
        "kokoro-agent"
      ],
      "id": "model-gateway",
      "providers": [
        "kokoro-platform"
      ],
      "version": 1
    },
    {
      "artifactDigest": "e4c0f68e5891c9f83a26b8a6c74552931f5d6d6c559c3d35a036aa3e53f90267",
      "consumers": [
        "kokoro-web"
      ],
      "id": "platform-admin-auth",
      "providers": [
        "kokoro-platform"
      ],
      "version": 1
    },
    {
      "consumers": [
        "kokoro-session"
      ],
      "id": "platform-runtime",
      "providers": [
        "kokoro-platform"
      ],
      "version": 1
    },
    {
      "consumers": [
        "kokoro-session"
      ],
      "id": "session-agent-execution",
      "providers": [
        "kokoro-agent"
      ],
      "version": 1
    },
    {
      "consumers": [
        "kokoro-web"
      ],
      "id": "session-browser",
      "providers": [
        "kokoro-session"
      ],
      "version": 1
    }
  ],
  "contractsDigest": "1de8f590f0fa643ba8e27802fc423533b4c402e995dec5bca657fa1cd27dcf0d",
  "evidence": [
    {
      "digest": "527e9fcee312cb96593aca75ce5114d67ab8acc1e51f98f9c56e4fd811fa8b03",
      "path": "docs/reports/evidence/wave-0/federated-repository-baseline.md"
    },
    {
      "digest": "9b96fe0fa3db3e7ef89b5a20a0b76335580f960d024ea47de828e900e325657e",
      "path": "docs/reports/evidence/wave-0/ownership-attestation.yaml"
    }
  ],
  "evidenceDigest": "0f840f8f5f135bc7399d48067891d1509a9826d7b2b18f3e5dbe6c496a9ece63",
  "generatorVersion": 1,
  "manifestDigest": "c54c3cacae82fde5bb04272b5b6d7c2047ad829d0d3e4a8e42bf3ea09288b20e",
  "matrixDigest": "ca7968e1744995ecd99156175aeca676e66e776aadfdd8b3e54c537f2de2e1e9",
  "promotionCommit": "06997bd0e5a26c34ed25c3f185ce4dde7412060f",
  "repositories": [
    {
      "id": "kokoro-agent",
      "origin": "https://github.com/LordFoxFairy/kokoro-agent.git",
      "path": "kokoro-agent",
      "pin": "9d3180e5b26b25d2ef8ce9c42636ef18a3305204",
      "protocols": [
        {
          "id": "model-gateway",
          "role": "consumer",
          "version": 1
        },
        {
          "id": "session-agent-execution",
          "role": "provider",
          "version": 1
        }
      ],
      "recoverableRef": "refs/tags/kokoro-wave0-hardening-2026-07-27-agent"
    },
    {
      "id": "kokoro-platform",
      "origin": "https://github.com/LordFoxFairy/kokoro-platform.git",
      "path": "kokoro-platform",
      "pin": "f0fd2e4e1e1de1017e0ad5dfacf42e1135576487",
      "protocols": [
        {
          "id": "model-gateway",
          "role": "provider",
          "version": 1
        },
        {
          "id": "platform-admin-auth",
          "role": "provider",
          "version": 1
        },
        {
          "id": "platform-runtime",
          "role": "provider",
          "version": 1
        }
      ],
      "recoverableRef": "refs/tags/kokoro-wave0-hardening-2026-07-27-platform"
    },
    {
      "id": "kokoro-session",
      "origin": "https://github.com/LordFoxFairy/kokoro-session.git",
      "path": "kokoro-session",
      "pin": "c24080c117aeafa3ec02db1700549057218baefa",
      "protocols": [
        {
          "id": "platform-runtime",
          "role": "consumer",
          "version": 1
        },
        {
          "id": "session-agent-execution",
          "role": "consumer",
          "version": 1
        },
        {
          "id": "session-browser",
          "role": "provider",
          "version": 1
        }
      ],
      "recoverableRef": "refs/tags/kokoro-wave0-foundation-2026-07-27-session"
    },
    {
      "id": "kokoro-web",
      "origin": "https://github.com/LordFoxFairy/kokoro-web.git",
      "path": "kokoro-web",
      "pin": "1934383ea4a72be9f2cc664af5de62b46c77c81c",
      "protocols": [
        {
          "id": "platform-admin-auth",
          "role": "consumer",
          "version": 1
        },
        {
          "id": "session-browser",
          "role": "consumer",
          "version": 1
        }
      ],
      "recoverableRef": "refs/tags/kokoro-wave0-foundation-2026-07-27-web-2"
    }
  ],
  "repositoryTopology": "federated-submodules-v1",
  "runtimeGate": {
    "combinationDigest": "e9f70fa06605aba4d53dfb4347f8671bc62e3d7a7cb9b035deec31612fcba73e",
    "combinationId": "wave0-hardening-2026-07-27",
    "evidenceDigest": "0bd44e4a9232ac58c345768f474cf2e880ac1fee31a11c2032f718fbe2bb8565",
    "outcome": "pass",
    "treeMode": "index"
  },
  "schemaVersion": 1
}
